{
  "$schema": "https://json-schema.org/draft/2020-12/schema",
  "$id": "https://nauqtype.dev/schemas/review-diff-v1.schema.json",
  "title": "Nauqtype Review Diff v1",
  "type": "object",
  "required": ["version", "command", "identity_scheme", "before", "after", "summary", "changes"],
  "additionalProperties": false,
  "properties": {
    "version": { "const": 1 },
    "command": { "const": "review-diff" },
    "identity_scheme": { "const": "nauqtype.semantic.v1" },
    "before": {
      "type": "object",
      "required": ["module"],
      "additionalProperties": false,
      "properties": { "module": { "type": "string" } }
    },
    "after": {
      "type": "object",
      "required": ["module"],
      "additionalProperties": false,
      "properties": { "module": { "type": "string" } }
    },
    "summary": { "$ref": "#/$defs/summary" },
    "changes": { "$ref": "#/$defs/changes" }
  },
  "$defs": {
    "summary": {
      "type": "object",
      "required": ["added_functions", "removed_functions", "changed_functions", "added_call_edges", "removed_call_edges"],
      "additionalProperties": false,
      "properties": {
        "added_functions": { "type": "integer", "minimum": 0 },
        "removed_functions": { "type": "integer", "minimum": 0 },
        "changed_functions": { "type": "integer", "minimum": 0 },
        "added_call_edges": { "type": "integer", "minimum": 0 },
        "removed_call_edges": { "type": "integer", "minimum": 0 }
      }
    },
    "changes": {
      "type": "object",
      "required": ["added_functions", "removed_functions", "changed_functions", "added_call_edges", "removed_call_edges"],
      "additionalProperties": false,
      "properties": {
        "added_functions": { "type": "array", "items": { "type": "string" } },
        "removed_functions": { "type": "array", "items": { "type": "string" } },
        "changed_functions": { "type": "array", "items": { "type": "string" } },
        "added_call_edges": { "type": "array", "items": { "type": "string" } },
        "removed_call_edges": { "type": "array", "items": { "type": "string" } }
      }
    }
  }
}
