{
  "version": 1,
  "command": "review-diff",
  "identity_scheme": "nauqtype.semantic.v1",
  "before": { "module": "main" },
  "after": { "module": "main" },
  "summary": {
    "added_functions": 0,
    "removed_functions": 0,
    "changed_functions": 2,
    "added_call_edges": 2,
    "removed_call_edges": 0
  },
  "changes": {
    "added_functions": [],
    "removed_functions": [],
    "changed_functions": [
      "fn:main::helper",
      "fn:main::main"
    ],
    "added_call_edges": [
      "fn:main::helper -> builtin:print_line",
      "fn:main::main -> fn:main::helper"
    ],
    "removed_call_edges": []
  }
}
